{"observed_format":"PNG","ocr":{"artifact_hash":"sha256:7d4322bd2a7749724879683fc3912cb542f19906c83bcc1a52132556427170b2","model_id":"eng","model_revision":"tessdata-v1","profile_revision":"tessdata-v1"},"pages":[{"page":1,"tokens":[{"bounding_box":{"height":0.35,"width":0.527272727,"x":0.036363636,"y":0.1},"canonical_token_text":"HELLO","confidence":0.95179,"join_after":"SPACE","ordinal":0,"page":1,"token_id":"ocr-token-0"},{"bounding_box":{"height":0.35,"width":0.29090909,"x":0.709090909,"y":0.1},"canonical_token_text":"125","confidence":0.922974,"join_after":"NONE","ordinal":1,"page":1,"token_id":"ocr-token-1"}],"warnings":[]}],"parser":{"artifact_hash":"sha256:63a6011302f25d388116ecd1ea78e08c5ac364cecbae6c9ac63b99b49ee3ae6e","name":"knowvault-tesseract-ocr","observation_profile_revision":"ocr-observation-v1","version":"1.0.0"},"result_version":"ocr-result-v1","warnings":[]}
